### ISSUE TITLE
Bypass china option cause GCM push connection error

### ISSUE THREAD

**Issue by hk3f** [shadowsocks/shadowsocks-android#350]
Phone:Vivo X5 Pro
Android 5.0
Gapps: open_gapps-arm64-5.0-pico-20150819
Shadowsocks:2.7.7
Root: Not fully rooted. Apps can get root permission but can not mount /system as r/w. Apps can access /data partion.

Connect GCM failed after check "Bypass LAN&China".
Connect GCM OK if check "Bypass LNA" or "All".
Tried "Global Proxy, "Per-App Proxy" and "Per-App proxy bypass mode"

![image](https://cloud.githubusercontent.com/assets/2787342/9373546/3b063808-471e-11e5-8651-73b86625600b.png)

**Comment by madeye** [comment]
What's test app are you using?

**Comment by hk3f** [comment]
I'm using GoogleServiceFramework internal debug interface to see the connection status.
dial *#*#426#*#*
And Push Notification Tester to verify if GCM push works fine.

**Comment by madeye** [comment]
![image](https://cloud.githubusercontent.com/assets/627917/9374503/4070219a-4729-11e5-87e8-4a44ba77b0ee.png)

Tried with China Unicom 3G, with CHN route enabled, everything works well.

**Comment by madeye** [comment]
Also, in your screenshot, I do not see any VPN icon on your status bar. Could you forget to enable shadowsocks when you doing the test?

**Comment by madeye** [comment]
Also tried with shadowsocks disabled, the GCM cannot connect as expected.

**Comment by hk3f** [comment]
I don't know why VPN icon does not show. But shadowsocks works fine.
![image](https://cloud.githubusercontent.com/assets/2787342/9374661/a97890cc-472a-11e5-8d4a-e351fc8047b8.png)

Is the ss thread correct in my device?
ps  | grep shadow
u0_a51    3874  301   1755192 52556 ffffffff 400520c4 S com.github.shadowsocks:vpn
u0_a51    15155 301   1648772 72240 ffffffff 40051ee0 S com.github.shadowsocks
u0_a51    18173 1     3452   588   001d439c 400520c4 S /data/data/com.github.shadowsocks/ss-local
u0_a51    18180 1     7312   424   ffffffff 400531a8 S /data/data/com.github.shadowsocks/pdnsd
u0_a51    18189 1     3444   552   001d439c 400520c4 S /data/data/com.github.shadowsocks/ss-tunnel
u0_a51    18199 1     3164   348   001d439c 400520c4 S /data/data/com.github.shadowsocks/tun2socks
root@bbk6752_lwt_l:/ # ps -Z | grep shadow
ps -Z | grep shadow
u:r:untrusted_app:s0           u0_a51    3874  301   com.github.shadowsocks:vpn
u:r:untrusted_app:s0           u0_a51    15155 301   com.github.shadowsocks
u:r:untrusted_app:s0           u0_a51    18173 1     /data/data/com.github.shadowsocks/ss-local
u:r:untrusted_app:s0           u0_a51    18180 1     /data/data/com.github.shadowsocks/pdnsd
u:r:untrusted_app:s0           u0_a51    18189 1     /data/data/com.github.shadowsocks/ss-tunnel
u:r:untrusted_app:s0           u0_a51    18199 1     /data/data/com.github.shadowsocks/tun2socks

**Comment by madeye** [comment]
Yes, it just works well.

Also, to ensure GCM is proxied properly, you need to use bypass mode if enabled per-app proxy.

**Comment by hk3f** [comment]
I tried to resintalled ss.
Found some different between previous and reinstalled /data/data directory:
![image](https://cloud.githubusercontent.com/assets/2787342/9374920/847967e4-472d-11e5-962a-b22dbeef52a0.png)

That may be the reason?
![image](https://cloud.githubusercontent.com/assets/2787342/9374945/d3610510-472d-11e5-880c-ad432f3855db.png)

**Comment by hk3f** [comment]
Still has this issue after reinstall ss

**Comment by madeye** [comment]
Have you modified /etc/hosts?

**Comment by hk3f** [comment]
No, previous hosts is moved.
root@bbk6752_lwt_l:/etc # ll hosts*
ll hosts*
-rw-r--r-- root     root       179653 2015-07-27 14:47 hosts2
-rw-r--r-- root     root          145 2015-08-19 15:21 hosts_gcm
-rw-rw-rw- root     root      1067648 2015-08-14 16:27 hosts_loadcn

**Comment by madeye** [comment]
Try to ping mtalk.google.com after enabling shadowsocks. Copy and paste the output here.

**Comment by madeye** [comment]
Also, in your first screenshot, GCM shows connected. What makes you think that GCM doesn't work?

**Comment by madeye** [comment]
Could you post the status of your GCM instead of events?

**Comment by hk3f** [comment]
The first screenshot has two status.
Early connected events are "Bypass LAN" and later connection err events are "Bypass LAN&China".

Here are status:
Bypass LAN:
![image](https://cloud.githubusercontent.com/assets/2787342/9375706/d95f1174-4736-11e5-90b5-bc16c4f38894.png)

Bypass LAN &CHina
![image](https://cloud.githubusercontent.com/assets/2787342/9375713/e352d6d4-4736-11e5-8d44-14461af5108b.png)

**Comment by hk3f** [comment]
I can not ping mtalk server no matter how setting shadowsocks.

![image](https://cloud.githubusercontent.com/assets/2787342/9375736/17595e62-4737-11e5-9f33-8616375e715d.png)

**Comment by hk3f** [comment]
Adb shell also lost all.

root@bbk6752_lwt_l:/ # su
su
root@bbk6752_lwt_l:/ # ping -c 3 mtalk.google.com
ping -c 3 mtalk.google.com
PING mobile-gtalk.l.google.com (74.125.130.188) 56(84) bytes of data.

--- mobile-gtalk.l.google.com ping statistics ---
3 packets transmitted, 0 received, 100% packet loss, time 2001ms

**Comment by madeye** [comment]
Upload your `acl.list` located at `/data/data/com.github.shadowsocks/`

**Comment by madeye** [comment]
BTW, are your sure you're using the global proxy mode?

**Comment by madeye** [comment]
If you known how to use `tcpdump`, you can try this one http://www.androidtcpdump.com/

To capture the trace,

1. use `netcfg` to determine your interface, which should be something like `rmnet_data0`.
2. run `tcpdump -i tmnet_data0 tcp dst port 5228`.

Then copy and paste your output here.

**Comment by hk3f** [comment]
acl.lst:

0.0.0.0/8
1.0.1.0/24
1.0.2.0/23
1.0.8.0/21
1.0.32.0/19
1.1.0.0/24
1.1.2.0/23
1.1.4.0/22
1.1.8.0/21
1.1.16.0/20
1.1.32.0/19
1.2.0.0/23
1.2.2.0/24
1.2.4.0/22
1.2.8.0/21
1.2.16.0/20
1.2.32.0/19
1.2.64.0/18
1.3.0.0/16
1.4.1.0/24
1.4.2.0/23
1.4.4.0/22
1.4.8.0/21
1.4.16.0/20
1.4.32.0/19
1.4.64.0/18
1.8.0.0/16
1.10.0.0/21
1.10.8.0/23
1.10.11.0/24
1.10.12.0/22
1.10.16.0/20
1.10.32.0/19
1.10.64.0/18
1.12.0.0/14
1.24.0.0/13
1.45.0.0/16
1.48.0.0/14
1.56.0.0/13
1.68.0.0/14
1.80.0.0/12
1.116.0.0/14
1.180.0.0/14
1.184.0.0/15
1.188.0.0/14
1.192.0.0/13
1.202.0.0/15
1.204.0.0/14
10.0.0.0/8
14.0.0.0/21
14.0.12.0/22
14.1.0.0/22
14.16.0.0/12
14.102.128.0/22
14.102.156.0/22
14.103.0.0/16
14.104.0.0/13
14.112.0.0/12
14.130.0.0/15
14.134.0.0/15
14.144.0.0/12
14.192.60.0/22
14.192.76.0/22
14.196.0.0/15
14.204.0.0/15
14.208.0.0/12
27.8.0.0/13
27.16.0.0/12
27.34.232.0/21
27.36.0.0/14
27.40.0.0/13
27.50.40.0/21
27.50.128.0/17
27.54.72.0/21
27.54.152.0/21
27.54.192.0/18
27.98.208.0/20
27.98.224.0/19
27.99.128.0/17
27.103.0.0/16
27.106.128.0/18
27.106.204.0/22
27.109.32.0/19
27.112.0.0/18
27.112.80.0/20
27.113.128.0/18
27.115.0.0/17
27.116.44.0/22
27.121.72.0/21
27.121.120.0/21
27.128.0.0/15
27.131.220.0/22
27.144.0.0/16
27.148.0.0/14
27.152.0.0/13
27.184.0.0/13
27.192.0.0/11
27.224.0.0/14
36.0.0.0/22
36.0.8.0/21
36.0.16.0/20
36.0.32.0/19
36.0.64.0/18
36.0.128.0/17
36.1.0.0/16
36.4.0.0/14
36.16.0.0/12
36.32.0.0/14
36.36.0.0/16
36.37.0.0/19
36.37.36.0/23
36.37.39.0/24
36.37.40.0/21
36.37.48.0/20
36.40.0.0/13
36.48.0.0/15
36.51.0.0/16
36.56.0.0/13
36.96.0.0/11
36.128.0.0/10
36.192.0.0/11
36.248.0.0/14
36.254.0.0/16
39.0.0.0/24
39.0.2.0/23
39.0.4.0/22
39.0.8.0/21
39.0.16.0/20
39.0.32.0/19
39.0.64.0/18
39.0.128.0/17
39.64.0.0/11
39.96.0.0/13
39.104.0.0/14
39.108.0.0/16
39.128.0.0/10
42.0.0.0/22
42.0.8.0/21
42.0.16.0/21
42.0.24.0/22
42.0.32.0/19
42.0.128.0/17
42.1.0.0/19
42.1.32.0/20
42.1.48.0/21
42.1.56.0/22
42.1.128.0/17
42.4.0.0/14
42.48.0.0/13
42.56.0.0/14
42.62.0.0/17
42.62.128.0/19
42.62.160.0/20
42.62.180.0/22
42.62.184.0/21
42.63.0.0/16
42.80.0.0/15
42.83.64.0/20
42.83.80.0/22
42.83.88.0/21
42.83.96.0/19
42.83.128.0/17
42.84.0.0/14
42.88.0.0/13
42.96.64.0/19
42.96.96.0/21
42.96.108.0/22
42.96.112.0/20
42.96.128.0/17
42.97.0.0/16
42.99.0.0/18
42.99.64.0/19
42.99.96.0/20
42.99.112.0/22
42.99.120.0/21
42.100.0.0/14
42.120.0.0/15
42.122.0.0/16
42.123.0.0/19
42.123.36.0/22
42.123.40.0/21
42.123.48.0/20
42.123.64.0/18
42.123.128.0/17
42.128.0.0/12
42.156.0.0/19
42.156.36.0/22
42.156.40.0/21
42.156.48.0/20
42.156.64.0/18
42.156.128.0/17
42.157.0.0/16
42.158.0.0/15
42.160.0.0/12
42.176.0.0/13
42.184.0.0/15
42.186.0.0/16
42.187.0.0/18
42.187.64.0/19
42.187.96.0/20
42.187.112.0/21
42.187.120.0/22
42.187.128.0/17
42.192.0.0/13
42.201.0.0/17
42.202.0.0/15
42.204.0.0/14
42.208.0.0/12
42.224.0.0/12
42.240.0.0/16
42.242.0.0/15
42.244.0.0/14
42.248.0.0/13
43.224.12.0/22
43.224.24.0/22
43.224.44.0/22
43.224.52.0/22
43.224.56.0/22
43.224.64.0/21
43.224.72.0/22
43.224.80.0/22
43.224.100.0/22
43.224.140.0/22
43.224.144.0/22
43.224.160.0/22
43.224.176.0/22
43.224.184.0/22
43.224.200.0/21
43.224.208.0/21
43.224.216.0/22
43.224.224.0/22
43.224.240.0/22
43.225.76.0/22
43.225.84.0/22
43.225.120.0/21
43.225.140.0/22
43.225.172.0/22
43.225.180.0/22
43.225.184.0/22
43.225.208.0/22
43.225.216.0/21
43.225.224.0/20
43.225.240.0/21
43.225.252.0/22
43.226.32.0/19
43.226.64.0/19
43.226.96.0/20
43.226.112.0/21
43.226.120.0/22
43.226.128.0/18
43.226.192.0/20
43.226.208.0/21
43.226.236.0/22
43.226.240.0/20
43.227.0.0/21
43.227.8.0/22
43.227.28.0/22
43.227.32.0/19
43.227.64.0/19
43.227.96.0/21
43.227.104.0/22
43.227.136.0/21
43.227.144.0/22
43.227.152.0/21
43.227.160.0/20
43.227.176.0/21
43.227.188.0/22
43.227.192.0/19
43.227.232.0/22
43.227.248.0/21
43.228.0.0/18
43.228.64.0/21
43.228.76.0/22
43.228.100.0/22
43.228.116.0/22
43.228.120.0/22
43.228.132.0/22
43.228.136.0/22
43.228.148.0/22
43.228.152.0/22
43.228.180.0/22
43.228.188.0/22
43.228.204.0/22
43.228.240.0/22
43.229.16.0/22
43.229.40.0/22
43.229.48.0/22
43.229.56.0/22
43.229.96.0/22
43.229.108.0/22
43.229.120.0/22
43.229.136.0/21
43.229.144.0/22
43.229.168.0/21
43.229.176.0/20
43.229.192.0/21
43.229.216.0/21
43.229.232.0/21
43.230.20.0/22
43.230.32.0/22
43.230.68.0/22
43.230.72.0/22
43.230.84.0/22
43.230.124.0/22
43.230.136.0/22
43.230.168.0/22
43.230.220.0/22
43.230.224.0/19
43.231.32.0/20
43.231.80.0/20
43.231.96.0/20
43.231.136.0/21
43.231.144.0/20
43.231.160.0/20
43.231.176.0/21
43.236.0.0/15
43.238.0.0/16
43.239.0.0/19
43.239.32.0/20
43.239.48.0/22
43.240.0.0/22
43.240.48.0/22
43.240.56.0/21
43.240.68.0/22
43.240.72.0/21
43.240.84.0/22
43.240.124.0/22
43.240.128.0/21
43.240.136.0/22
43.240.156.0/22
43.240.160.0/19
43.240.192.0/19
43.240.236.0/22
43.240.240.0/20
43.241.0.0/20
43.241.16.0/21
43.241.48.0/22
43.241.76.0/22
43.241.80.0/20
43.241.112.0/22
43.241.168.0/21
43.241.176.0/21
43.241.184.0/22
43.241.196.0/22
43.241.208.0/20
43.241.224.0/20
43.241.240.0/22
43.241.248.0/21
43.242.8.0/21
43.242.16.0/20
43.242.44.0/22
43.242.48.0/20
43.242.64.0/22
43.242.72.0/21
43.242.80.0/20
43.242.96.0/22
43.242.144.0/20
43.242.160.0/21
43.242.168.0/22
43.242.180.0/22
43.242.188.0/22
43.242.192.0/21
43.242.204.0/22
43.242.216.0/21
43.242.252.0/22
43.243.4.0/22
43.243.8.0/21
43.243.16.0/22
43.243.24.0/22
43.243.88.0/22
43.243.128.0/22
43.243.136.0/22
43.243.144.0/21
43.243.156.0/22
43.243.168.0/22
43.243.180.0/22
43.243.188.0/22
43.243.228.0/22
43.243.232.0/22
43.243.244.0/22
43.246.0.0/18
43.246.64.0/19
43.246.96.0/22
43.247.4.0/22
43.247.8.0/22
43.247.44.0/22
43.247.48.0/22
43.247.68.0/22
43.247.76.0/22
43.247.84.0/22
43.247.88.0/21
43.247.96.0/21
43.247.108.0/22
43.247.112.0/22
43.247.148.0/22
43.247.152.0/22
43.247.176.0/20
43.247.196.0/22
43.247.200.0/21
43.247.208.0/20
43.247.224.0/19
43.248.0.0/21
43.248.20.0/22
43.248.28.0/22
43.248.48.0/22
43.248.56.0/22
43.248.76.0/22
43.248.80.0/20
43.248.96.0/19
43.248.128.0/20
43.248.144.0/21
43.248.176.0/20
43.248.192.0/20
43.248.208.0/22
43.248.228.0/22
43.248.232.0/22
43.248.244.0/22
43.249.0.0/21
43.249.8.0/22
43.249.24.0/22
43.249.120.0/22
43.249.132.0/22
43.249.136.0/22
43.249.144.0/20
43.249.160.0/21
43.249.168.0/22
43.249.192.0/22
43.249.236.0/22
43.250.4.0/22
43.250.12.0/22
43.250.16.0/21
43.250.28.0/22
43.250.32.0/21
43.250.72.0/22
43.250.96.0/20
43.250.112.0/21
43.250.128.0/22
43.250.144.0/21
43.250.160.0/22
43.250.168.0/21
43.250.176.0/22
43.250.200.0/22
43.250.212.0/22
43.250.216.0/21
43.250.236.0/22
43.250.244.0/22
43.251.4.0/22
43.251.8.0/21
43.251.16.0/23
43.251.36.0/22
43.251.116.0/22
43.251.192.0/22
43.251.232.0/21
43.251.244.0/22
43.252.40.0/22
43.252.48.0/22
43.252.56.0/22
43.252.224.0/22
43.254.0.0/21
43.254.8.0/22
43.254.24.0/22
43.254.36.0/22
43.254.44.0/22
43.254.52.0/22
43.254.64.0/22
43.254.72.0/22
43.254.84.0/22
43.254.88.0/21
43.254.100.0/22
43.254.104.0/22
43.254.112.0/21
43.254.128.0/22
43.254.136.0/21
43.254.144.0/20
43.254.168.0/21
43.254.180.0/22
43.254.184.0/21
43.254.192.0/21
43.254.200.0/22
43.254.208.0/22
43.254.220.0/22
43.254.224.0/20
43.254.240.0/22
43.254.248.0/21
43.255.0.0/21
43.255.8.0/22
43.255.16.0/22
43.255.48.0/22
43.255.60.0/22
43.255.64.0/20
43.255.84.0/22
43.255.96.0/22
43.255.108.0/22
43.255.144.0/22
43.255.168.0/22
43.255.176.0/22
43.255.184.0/22
43.255.192.0/22
43.255.200.0/21
43.255.208.0/21
43.255.224.0/21
43.255.232.0/22
43.255.244.0/22
45.64.112.0/23
49.4.0.0/14
49.51.0.0/16
49.52.0.0/14
49.64.0.0/11
49.112.0.0/13
49.120.0.0/14
49.128.0.0/24
49.128.2.0/23
49.140.0.0/15
49.152.0.0/14
49.208.0.0/14
49.220.0.0/14
49.232.0.0/14
49.239.0.0/18
49.239.192.0/18
49.246.224.0/19
54.222.0.0/15
58.14.0.0/15
58.16.0.0/13
58.24.0.0/15
58.30.0.0/15
58.32.0.0/11
58.65.232.0/21
58.66.0.0/15
58.68.128.0/17
58.82.0.0/17
58.83.0.0/16
58.87.64.0/18
58.99.128.0/17
58.100.0.0/15
58.116.0.0/14
58.128.0.0/13
58.144.0.0/16
58.154.0.0/15
58.192.0.0/11
58.240.0.0/12
59.32.0.0/11
59.64.0.0/12
59.80.0.0/14
59.107.0.0/16
59.108.0.0/14
59.151.0.0/17
59.155.0.0/16
59.172.0.0/14
59.191.0.0/17
59.191.240.0/20
59.192.0.0/10
60.0.0.0/11
60.55.0.0/16
60.63.0.0/16
60.160.0.0/11
60.194.0.0/15
60.200.0.0/13
60.208.0.0/12
60.232.0.0/15
60.235.0.0/16
60.245.128.0/17
60.247.0.0/16
60.252.0.0/16
60.253.128.0/17
60.255.0.0/16
61.4.80.0/20
61.4.176.0/20
61.8.160.0/20
61.28.0.0/17
61.29.128.0/17
61.45.128.0/18
61.45.224.0/20
61.47.128.0/18
61.48.0.0/13
61.87.192.0/18
61.128.0.0/10
61.232.0.0/14
61.236.0.0/15
61.240.0.0/14
100.64.0.0/10
101.0.0.0/22
101.1.0.0/22
101.2.172.0/22
101.4.0.0/14
101.16.0.0/12
101.32.0.0/12
101.48.0.0/15
101.50.56.0/22
101.52.0.0/16
101.53.100.0/22
101.54.0.0/16
101.55.224.0/21
101.64.0.0/13
101.72.0.0/14
101.76.0.0/15
101.78.0.0/22
101.78.32.0/19
101.80.0.0/12
101.96.0.0/21
101.96.8.0/22
101.96.16.0/20
101.96.128.0/17
101.99.96.0/19
101.101.64.0/19
101.101.100.0/24
101.101.102.0/23
101.101.104.0/21
101.101.112.0/20
101.102.64.0/19
101.102.100.0/23
101.102.102.0/24
101.102.104.0/21
101.102.112.0/20
101.104.0.0/14
101.110.64.0/19
101.110.96.0/20
101.110.116.0/22
101.110.120.0/21
101.120.0.0/14
101.124.0.0/15
101.126.0.0/16
101.128.0.0/22
101.128.8.0/21
101.128.16.0/20
101.128.32.0/19
101.129.0.0/16
101.130.0.0/15
101.132.0.0/14
101.144.0.0/12
101.192.0.0/13
101.200.0.0/15
101.203.128.0/19
101.203.160.0/21
101.203.172.0/22
101.203.176.0/20
101.204.0.0/14
101.224.0.0/13
101.232.0.0/15
101.234.64.0/21
101.234.76.0/22
101.234.80.0/20
101.234.96.0/19
101.236.0.0/14
101.240.0.0/13
101.248.0.0/15
101.251.0.0/22
101.251.8.0/21
101.251.16.0/20
101.251.32.0/19
101.251.64.0/18
101.251.128.0/17
101.252.0.0/15
101.254.0.0/16
103.1.8.0/22
103.1.20.0/22
103.1.24.0/22
103.1.72.0/22
103.1.88.0/22
103.1.168.0/22
103.2.108.0/22
103.2.156.0/22
103.2.164.0/22
103.2.200.0/21
103.2.208.0/21
103.3.84.0/22
103.3.88.0/21
103.3.96.0/19
103.3.128.0/20
103.3.148.0/22
103.3.152.0/21
103.4.56.0/22
103.4.168.0/22
103.4.184.0/22
103.5.36.0/22
103.5.52.0/22
103.5.56.0/22
103.5.252.0/22
103.6.76.0/22
103.6.220.0/22
103.7.4.0/22
103.7.28.0/22
103.7.212.0/22
103.7.216.0/21
103.8.4.0/22
103.8.8.0/22
103.8.32.0/22
103.8.52.0/22
103.8.108.0/22
103.8.156.0/22
103.8.200.0/21
103.8.220.0/22
103.9.152.0/22
103.9.248.0/21
103.10.0.0/22
103.10.16.0/22
103.10.84.0/22
103.10.111.0/24
103.10.140.0/22
103.11.180.0/22
103.12.32.0/22
103.12.68.0/22
103.12.136.0/22
103.12.184.0/22
103.12.232.0/22
103.13.124.0/22
103.13.144.0/22
103.13.196.0/22
103.13.244.0/22
103.14.84.0/22
103.14.112.0/22
103.14.132.0/22
103.14.136.0/22
103.14.156.0/22
103.14.240.0/22
103.15.4.0/22
103.15.8.0/22
103.15.16.0/22
103.15.96.0/22
103.15.200.0/22
103.16.52.0/22
103.16.80.0/21
103.16.88.0/22
103.16.108.0/22
103.16.124.0/22
103.17.40.0/22
103.17.120.0/22
103.17.160.0/22
103.17.204.0/22
103.17.228.0/22
103.18.192.0/22
103.18.208.0/21
103.18.224.0/22
103.19.12.0/22
103.19.40.0/21
103.19.64.0/21
103.19.72.0/22
103.19.232.0/22
103.20.12.0/22
103.20.32.0/22
103.20.112.0/22
103.20.128.0/22
103.20.160.0/22
103.20.248.0/22
103.21.112.0/21
103.21.136.0/21
103.21.176.0/22
103.21.208.0/22
103.21.240.0/22
103.22.0.0/18
103.22.64.0/19
103.22.100.0/22
103.22.104.0/21
103.22.112.0/20
103.22.188.0/22
103.22.228.0/22
103.22.252.0/22
103.23.8.0/22
103.23.56.0/22
103.23.160.0/21
103.23.176.0/22
103.23.228.0/22
103.24.116.0/22
103.24.128.0/22
103.24.144.0/22
103.24.176.0/22
103.24.184.0/22
103.24.220.0/22
103.24.228.0/22
103.24.248.0/21
103.25.8.0/23
103.25.20.0/22
103.25.24.0/21
103.25.32.0/21
103.25.40.0/22
103.25.48.0/22
103.25.64.0/21
103.25.148.0/22
103.25.156.0/22
103.25.216.0/22
103.26.0.0/22
103.26.64.0/22
103.26.156.0/22
103.26.160.0/22
103.26.228.0/22
103.26.240.0/22
103.27.4.0/22
103.27.12.0/22
103.27.24.0/22
103.27.56.0/22
103.27.96.0/22
103.27.208.0/22
103.27.240.0/22
103.28.4.0/22
103.28.8.0/22
103.28.204.0/22
103.29.16.0/22
103.29.128.0/21
103.29.136.0/22
103.30.20.0/22
103.30.96.0/22
103.30.148.0/22
103.30.200.0/22
103.30.216.0/22
103.30.228.0/22
103.30.236.0/22
103.31.0.0/22
103.31.48.0/20
103.31.64.0/21
103.31.148.0/22
103.31.160.0/22
103.31.168.0/22
103.31.200.0/22
103.32.0.0/15
103.34.0.0/16
103.35.0.0/19
103.35.32.0/20
103.35.48.0/22
103.36.20.0/22
103.36.28.0/22
103.36.36.0/22
103.36.56.0/21
103.36.64.0/22
103.36.72.0/22
103.36.96.0/22
103.36.132.0/22
103.36.136.0/22
103.36.160.0/19
103.36.192.0/19
103.36.224.0/20
103.36.240.0/21
103.37.0.0/22
103.37.12.0/22
103.37.16.0/22
103.37.24.0/22
103.37.44.0/22
103.37.52.0/22
103.37.56.0/22
103.37.72.0/22
103.37.100.0/22
103.37.104.0/22
103.37.124.0/22
103.37.136.0/21
103.37.144.0/20
103.37.160.0/21
103.37.172.0/22
103.37.176.0/22
103.37.208.0/20
103.37.248.0/21
103.38.0.0/22
103.38.32.0/22
103.38.40.0/21
103.38.56.0/22
103.38.76.0/22
103.38.84.0/22
103.38.92.0/22
103.38.96.0/22
103.38.116.0/22
103.38.132.0/22
103.38.140.0/22
103.38.220.0/22
103.38.224.0/21
103.38.232.0/22
103.38.252.0/22
103.39.16.0/22
103.39.64.0/22
103.39.88.0/22
103.39.100.0/22
103.39.104.0/21
103.39.144.0/22
103.39.160.0/19
103.39.200.0/21
103.39.208.0/20
103.39.224.0/21
103.39.232.0/22
103.40.12.0/22
103.40.16.0/20
103.40.32.0/20
103.40.88.0/22
103.40.100.0/22
103.40.112.0/22
103.40.192.0/22
103.40.212.0/22
103.40.220.0/22
103.40.228.0/22
103.40.232.0/21
103.40.240.0/20
103.41.0.0/22
103.41.16.0/22
103.41.52.0/22
103.41.116.0/22
103.41.140.0/22
103.41.148.0/22
103.41.152.0/22
103.41.160.0/21
103.41.220.0/22
103.41.224.0/21
103.41.232.0/22
103.42.8.0/22
103.42.24.0/21
103.42.32.0/22
103.42.64.0/21
103.42.76.0/22
103.42.104.0/22
103.42.180.0/22
103.42.232.0/22
103.43.16.0/22
103.43.24.0/22
103.43.84.0/22
103.43.96.0/21
103.43.104.0/22
103.43.124.0/22
103.43.132.0/22
103.43.164.0/22
103.43.184.0/22
103.43.192.0/21
103.43.208.0/22
103.43.220.0/22
103.43.224.0/22
103.43.232.0/22
103.43.240.0/22
103.44.56.0/22
103.44.80.0/22
103.44.88.0/22
103.44.120.0/21
103.44.132.0/22
103.44.144.0/22
103.44.152.0/22
103.44.168.0/22
103.44.176.0/20
103.44.192.0/20
103.44.224.0/22
103.44.236.0/22
103.44.240.0/20
103.45.0.0/18
103.45.72.0/21
103.45.80.0/20
103.45.96.0/19
103.45.128.0/18
103.45.192.0/19
103.45.224.0/22
103.45.248.0/22
103.46.0.0/22
103.46.12.0/22
103.46.16.0/20
103.46.32.0/19
103.46.64.0/18
103.46.128.0/21
103.46.136.0/22
103.46.152.0/21
103.46.160.0/20
103.46.176.0/21
103.46.244.0/22
103.46.248.0/22
103.47.4.0/22
103.47.20.0/22
103.47.36.0/22
103.47.40.0/22
103.47.48.0/22
103.47.80.0/22
103.47.96.0/22
103.47.108.0/22
103.47.116.0/22
103.47.120.0/22
103.47.136.0/21
103.47.200.0/22
103.47.212.0/22
103.47.220.0/22
103.47.248.0/22
103.48.20.0/22
103.48.52.0/22
103.48.92.0/22
103.48.144.0/20
103.48.202.0/23
103.48.216.0/21
103.48.224.0/20
103.48.240.0/21
103.49.12.0/22
103.49.20.0/22
103.49.72.0/21
103.49.92.0/22
103.49.96.0/22
103.49.108.0/22
103.49.128.0/22
103.49.176.0/21
103.49.196.0/22
103.49.248.0/22
103.50.36.0/22
103.50.44.0/22
103.50.48.0/20
103.50.64.0/21
103.50.72.0/22
103.50.108.0/22
103.50.112.0/20
103.50.132.0/22
103.50.136.0/21
103.50.172.0/22
103.50.176.0/20
103.50.192.0/21
103.50.200.0/22
103.50.220.0/22
103.50.224.0/20
103.50.240.0/21
103.50.248.0/22
103.224.40.0/21
103.224.60.0/22
103.224.80.0/22
103.224.220.0/22
103.224.224.0/21
103.224.232.0/22
103.225.84.0/22
103.226.16.0/22
103.226.40.0/22
103.226.56.0/21
103.226.80.0/22
103.226.116.0/22
103.226.132.0/22
103.226.156.0/22
103.226.180.0/22
103.226.196.0/22
103.227.48.0/22
103.227.72.0/21
103.227.80.0/22
103.227.100.0/22
103.227.120.0/22
103.227.132.0/22
103.227.136.0/22
103.227.196.0/22
103.227.204.0/22
103.227.212.0/22
103.227.228.0/22
103.228.12.0/22
103.228.28.0/22
103.228.68.0/22
103.228.88.0/22
103.228.128.0/22
103.228.160.0/22
103.228.176.0/22
103.228.204.0/22
103.228.208.0/22
103.228.228.0/22
103.228.232.0/22
103.229.20.0/22
103.229.136.0/22
103.229.148.0/22
103.229.172.0/22
103.229.212.0/22
103.229.216.0/21
103.229.228.0/22
103.229.236.0/22
103.229.240.0/22
103.230.0.0/22
103.230.28.0/22
103.230.40.0/21
103.230.96.0/22
103.230.196.0/22
103.230.200.0/21
103.230.212.0/22
103.230.236.0/22
103.231.16.0/21
103.231.64.0/21
103.231.144.0/22
103.231.180.0/22
103.231.184.0/22
103.231.244.0/22
103.232.4.0/22
103.232.144.0/22
103.232.212.0/22
103.233.4.0/22
103.233.44.0/22
103.233.52.0/22
103.233.104.0/22
103.233.128.0/22
103.233.136.0/22
103.233.228.0/22
103.234.0.0/22
103.234.20.0/22
103.234.56.0/22
103.234.124.0/22
103.234.128.0/22
103.234.172.0/22
103.234.180.0/22
103.235.16.0/22
103.235.48.0/22
103.235.56.0/21
103.235.80.0/21
103.235.128.0/20
103.235.144.0/21
103.235.184.0/22
103.235.192.0/22
103.235.200.0/22
103.235.220.0/22
103.235.224.0/19
103.236.0.0/18
103.236.64.0/19
103.236.96.0/22
103.237.0.0/20
103.237.24.0/21
103.237.68.0/22
103.237.88.0/22
103.237.152.0/22
103.237.176.0/20
103.237.192.0/18
103.238.0.0/21
103.238.16.0/20
103.238.32.0/20
103.238.48.0/21
103.238.56.0/22
103.238.88.0/21
103.238.96.0/22
103.238.132.0/22
103.238.140.0/22
103.238.144.0/22
103.238.160.0/19
103.238.196.0/22
103.238.204.0/22
103.238.252.0/22
103.239.0.0/22
103.239.40.0/21
103.239.68.0/22
103.239.96.0/22
103.239.152.0/21
103.239.176.0/21
103.239.184.0/22
103.239.192.0/21
103.239.204.0/22
103.239.208.0/22
103.239.224.0/22
103.239.244.0/22
103.240.16.0/22
103.240.36.0/22
103.240.72.0/22
103.240.84.0/22
103.240.124.0/22
103.240.156.0/22
103.240.172.0/22
103.240.244.0/22
103.241.12.0/22
103.241.72.0/22
103.241.92.0/22
103.241.96.0/22
103.241.160.0/22
103.241.184.0/21
103.241.220.0/22
103.242.8.0/22
103.242.64.0/22
103.242.128.0/21
103.242.160.0/22
103.242.168.0/21
103.242.176.0/22
103.242.200.0/22
103.242.212.0/22
103.242.220.0/22
103.242.240.0/22
103.243.24.0/22
103.243.136.0/22
103.243.252.0/22
103.244.16.0/22
103.244.58.0/23
103.244.60.0/22
103.244.64.0/20
103.244.80.0/21
103.244.164.0/22
103.244.232.0/22
103.244.252.0/22
103.245.23.0/24
103.245.52.0/22
103.245.60.0/22
103.245.80.0/22
103.245.124.0/22
103.245.128.0/22
103.246.8.0/21
103.246.120.0/21
103.246.132.0/22
103.246.152.0/21
103.247.168.0/21
103.247.176.0/22
103.247.200.0/22
103.247.212.0/22
103.248.0.0/23
103.248.64.0/22
103.248.100.0/22
103.248.124.0/22
103.248.152.0/22
103.248.168.0/22
103.248.192.0/22
103.248.212.0/22
103.248.224.0/21
103.249.12.0/22
103.249.52.0/22
103.249.128.0/22
103.249.136.0/22
103.249.144.0/22
103.249.164.0/22
103.249.168.0/21
103.249.176.0/22
103.249.188.0/22
103.249.192.0/22
103.249.244.0/22
103.249.252.0/22
103.250.32.0/22
103.250.104.0/22
103.250.124.0/22
103.250.180.0/22
103.250.192.0/22
103.250.216.0/22
103.250.224.0/22
103.250.236.0/22
103.250.248.0/21
103.251.32.0/22
103.251.84.0/22
103.251.96.0/22
103.251.124.0/22
103.251.128.0/22
103.251.160.0/22
103.251.204.0/22
103.251.236.0/22
103.251.240.0/22
103.252.28.0/22
103.252.36.0/22
103.252.64.0/22
103.252.104.0/22
103.252.172.0/22
103.252.204.0/22
103.252.208.0/22
103.252.232.0/22
103.252.248.0/22
103.253.4.0/22
103.253.60.0/22
103.253.204.0/22
103.253.220.0/22
103.253.224.0/22
103.253.232.0/22
103.254.8.0/22
103.254.20.0/22
103.254.64.0/20
103.254.112.0/22
103.254.176.0/22
103.254.188.0/22
103.254.196.0/24
103.254.220.0/22
103.255.68.0/22
103.255.88.0/21
103.255.136.0/21
103.255.184.0/22
103.255.200.0/22
103.255.208.0/21
103.255.228.0/22
106.0.0.0/24
106.0.2.0/23
106.0.4.0/22
106.0.8.0/21
106.0.16.0/20
106.0.64.0/18
106.2.0.0/15
106.4.0.0/14
106.8.0.0/15
106.11.0.0/16
106.12.0.0/14
106.16.0.0/12
106.32.0.0/12
106.48.0.0/15
106.50.0.0/16
106.52.0.0/14
106.56.0.0/13
106.74.0.0/15
106.80.0.0/12
106.108.0.0/14
106.112.0.0/12
106.224.0.0/12
110.6.0.0/15
110.16.0.0/14
110.40.0.0/14
110.44.144.0/20
110.48.0.0/16
110.51.0.0/16
110.52.0.0/15
110.56.0.0/13
110.64.0.0/15
110.72.0.0/15
110.75.0.0/16
110.76.0.0/18
110.76.156.0/22
110.76.184.0/22
110.76.192.0/18
110.77.0.0/17
110.80.0.0/13
110.88.0.0/14
110.93.32.0/19
110.94.0.0/15
110.96.0.0/11
110.152.0.0/14
110.156.0.0/15
110.165.32.0/19
110.166.0.0/15
110.172.192.0/18
110.173.0.0/19
110.173.32.0/20
110.173.64.0/18
110.173.192.0/19
110.176.0.0/12
110.192.0.0/11
110.228.0.0/14
110.232.32.0/19
110.236.0.0/15
110.240.0.0/12
111.0.0.0/10
111.66.0.0/16
111.67.192.0/20
111.68.64.0/19
111.72.0.0/13
111.85.0.0/16
111.91.192.0/19
111.112.0.0/14
111.116.0.0/15
111.118.200.0/21
111.119.64.0/18
111.119.128.0/19
111.120.0.0/14
111.124.0.0/16
111.126.0.0/15
111.128.0.0/11
111.160.0.0/13
111.170.0.0/16
111.172.0.0/14
111.176.0.0/13
111.186.0.0/15
111.192.0.0/12
111.208.0.0/13
111.221.28.0/24
111.221.128.0/17
111.222.0.0/16
111.223.240.0/22
111.223.248.0/22
111.224.0.0/13
111.235.96.0/19
111.235.156.0/22
111.235.160.0/19
112.0.0.0/10
112.64.0.0/14
112.73.0.0/16
112.74.0.0/15
112.80.0.0/12
112.96.0.0/13
112.109.128.0/17
112.111.0.0/16
112.112.0.0/14
112.116.0.0/15
112.122.0.0/15
112.124.0.0/14
112.128.0.0/14
112.132.0.0/16
112.137.48.0/21
112.192.0.0/14
112.224.0.0/11
113.0.0.0/13
113.8.0.0/15
113.11.192.0/19
113.12.0.0/14
113.16.0.0/15
113.18.0.0/16
113.24.0.0/14
113.31.0.0/16
113.44.0.0/14
113.48.0.0/14
113.52.160.0/19
113.54.0.0/15
113.56.0.0/15
113.58.0.0/16
113.59.0.0/17
113.59.224.0/22
113.62.0.0/15
113.64.0.0/10
113.128.0.0/15
113.130.96.0/20
113.130.112.0/21
113.132.0.0/14
113.136.0.0/13
113.194.0.0/15
113.197.100.0/22
113.200.0.0/15
113.202.0.0/16
113.204.0.0/14
113.208.96.0/19
113.208.128.0/17
113.209.0.0/16
113.212.0.0/18
113.212.100.0/22
113.212.184.0/21
113.213.0.0/17
113.214.0.0/15
113.218.0.0/15
113.220.0.0/14
113.224.0.0/12
113.240.0.0/13
113.248.0.0/14
114.28.0.0/16
114.54.0.0/15
114.60.0.0/14
114.64.0.0/14
114.68.0.0/16
114.79.64.0/18
114.80.0.0/12
114.96.0.0/13
114.104.0.0/14
114.110.0.0/20
114.110.64.0/18
114.111.0.0/19
114.111.160.0/19
114.112.0.0/13
114.132.0.0/16
114.135.0.0/16
114.138.0.0/15
114.141.64.0/21
114.141.128.0/18
114.196.0.0/15
114.198.248.0/21
114.208.0.0/12
114.224.0.0/11
115.24.0.0/14
115.28.0.0/15
115.32.0.0/14
115.44.0.0/14
115.48.0.0/12
115.69.64.0/20
115.84.0.0/18
115.84.192.0/19
115.85.192.0/18
115.100.0.0/14
115.104.0.0/14
115.120.0.0/14
115.124.16.0/20
115.148.0.0/14
115.152.0.0/13
115.166.64.0/19
115.168.0.0/13
115.180.0.0/14
115.190.0.0/15
115.192.0.0/11
115.224.0.0/12
116.0.8.0/21
116.0.24.0/21
116.1.0.0/16
116.2.0.0/15
116.4.0.0/14
116.8.0.0/14
116.13.0.0/16
116.16.0.0/12
116.50.0.0/20
116.52.0.0/14
116.56.0.0/15
116.58.128.0/20
116.58.208.0/20
116.60.0.0/14
116.66.0.0/17
116.69.0.0/16
116.70.0.0/17
116.76.0.0/14
116.85.0.0/16
116.89.144.0/20
116.90.80.0/20
116.90.184.0/21
116.95.0.0/16
116.112.0.0/14
116.116.0.0/15
116.128.0.0/10
116.192.0.0/16
116.193.16.0/20
116.193.32.0/19
116.193.176.0/21
116.194.0.0/15
116.196.0.0/16
116.198.0.0/16
116.199.0.0/17
116.199.128.0/19
116.204.0.0/15
116.207.0.0/16
116.208.0.0/14
116.212.160.0/20
116.213.64.0/18
116.213.128.0/17
116.214.32.0/19
116.214.64.0/20
116.214.128.0/17
116.215.0.0/16
116.216.0.0/14
116.224.0.0/12
116.242.0.0/15
116.244.0.0/14
116.248.0.0/15
116.251.64.0/18
116.252.0.0/15
116.254.128.0/17
116.255.128.0/17
117.8.0.0/13
117.21.0.0/16
117.22.0.0/15
117.24.0.0/13
117.32.0.0/13
117.40.0.0/14
117.44.0.0/15
117.48.0.0/14
117.53.48.0/20
117.53.176.0/20
117.57.0.0/16
117.58.0.0/17
117.59.0.0/16
117.60.0.0/14
117.64.0.0/13
117.72.0.0/15
117.74.64.0/19
117.74.128.0/17
117.75.0.0/16
117.76.0.0/14
117.80.0.0/12
117.100.0.0/15
117.103.16.0/20
117.103.40.0/21
117.103.72.0/21
117.103.128.0/20
117.104.168.0/21
117.106.0.0/15
117.112.0.0/13
117.120.64.0/18
117.120.128.0/17
117.121.0.0/17
117.121.128.0/18
117.121.192.0/21
117.122.128.0/17
117.124.0.0/14
117.128.0.0/10
118.24.0.0/15
118.26.0.0/16
118.28.0.0/14
118.64.0.0/15
118.66.0.0/16
118.67.112.0/20
118.72.0.0/13
118.80.0.0/15
118.84.0.0/15
118.88.32.0/19
118.88.64.0/18
118.88.128.0/17
118.89.0.0/16
118.91.240.0/20
118.102.16.0/20
118.102.32.0/21
118.112.0.0/13
118.120.0.0/14
118.124.0.0/15
118.126.0.0/16
118.127.128.0/19
118.132.0.0/14
118.144.0.0/14
118.178.0.0/16
118.180.0.0/14
118.184.0.0/16
118.186.0.0/15
118.188.0.0/16
118.190.0.0/15
118.192.0.0/13
118.202.0.0/15
118.204.0.0/14
118.212.0.0/15
118.224.0.0/14
118.228.0.0/15
118.230.0.0/16
118.239.0.0/16
118.242.0.0/16
118.244.0.0/14
118.248.0.0/13
119.0.0.0/15
119.2.0.0/19
119.2.128.0/17
119.3.0.0/16
119.4.0.0/14
119.8.0.0/16
119.10.0.0/17
119.15.136.0/21
119.16.0.0/16
119.18.192.0/20
119.18.208.0/21
119.18.224.0/19
119.19.0.0/16
119.20.0.0/14
119.27.64.0/18
119.27.128.0/17
119.28.0.0/15
119.30.48.0/20
119.31.192.0/19
119.32.0.0/13
119.40.0.0/18
119.40.64.0/20
119.40.128.0/17
119.41.0.0/16
119.42.0.0/19
119.42.128.0/20
119.42.224.0/19
119.44.0.0/15
119.48.0.0/13
119.57.0.0/16
119.58.0.0/16
119.59.128.0/17
119.60.0.0/15
119.62.0.0/16
119.63.32.0/19
119.75.208.0/20
119.78.0.0/15
119.80.0.0/16
119.82.208.0/20
119.84.0.0/14
119.88.0.0/14
119.96.0.0/13
119.108.0.0/15
119.112.0.0/12
119.128.0.0/12
119.144.0.0/14
119.148.160.0/19
119.151.192.0/18
119.160.200.0/21
119.161.128.0/17
119.162.0.0/15
119.164.0.0/14
119.176.0.0/12
119.232.0.0/15
119.235.128.0/18
119.248.0.0/14
119.252.96.0/21
119.252.240.0/20
119.253.0.0/16
119.254.0.0/15
120.0.0.0/12
120.24.0.0/14
120.30.0.0/15
120.32.0.0/12
120.48.0.0/15
120.52.0.0/14
120.64.0.0/13
120.72.32.0/19
120.72.128.0/17
120.76.0.0/14
120.80.0.0/13
120.88.8.0/21
120.90.0.0/15
120.92.0.0/16
120.94.0.0/15
120.128.0.0/13
120.136.128.0/18
120.137.0.0/17
120.143.128.0/19
120.192.0.0/10
121.0.8.0/21
121.0.16.0/20
121.4.0.0/15
121.8.0.0/13
121.16.0.0/12
121.32.0.0/13
121.40.0.0/14
121.46.0.0/18
121.46.128.0/17
121.47.0.0/16
121.48.0.0/15
121.50.8.0/21
121.51.0.0/16
121.52.160.0/19
121.52.208.0/20
121.52.224.0/19
121.54.176.0/21
121.55.0.0/18
121.56.0.0/15
121.58.0.0/17
121.58.136.0/21
121.58.144.0/20
121.58.160.0/21
121.59.0.0/16
121.60.0.0/14
121.68.0.0/14
121.76.0.0/15
121.79.128.0/18
121.89.0.0/16
121.100.128.0/17
121.101.0.0/18
121.101.208.0/20
121.192.0.0/13
121.200.192.0/21
121.201.0.0/16
121.204.0.0/14
121.224.0.0/12
121.248.0.0/14
121.255.0.0/16
122.0.64.0/18
122.0.128.0/17
122.4.0.0/14
122.8.0.0/15
122.10.0.0/16
122.11.0.0/17
122.12.0.0/15
122.14.0.0/16
122.48.0.0/16
122.49.0.0/18
122.51.0.0/16
122.64.0.0/11
122.96.0.0/15
122.102.0.0/20
122.102.64.0/19
122.112.0.0/14
122.119.0.0/16
122.128.120.0/21
122.136.0.0/13
122.144.128.0/17
122.152.192.0/18
122.156.0.0/14
122.188.0.0/14
122.192.0.0/14
122.198.0.0/16
122.200.64.0/18
122.201.48.0/20
122.204.0.0/14
122.224.0.0/12
122.240.0.0/13
122.248.24.0/21
122.248.48.0/20
122.255.64.0/21
123.0.128.0/18
123.4.0.0/14
123.8.0.0/13
123.49.128.0/17
123.50.160.0/19
123.52.0.0/14
123.56.0.0/14
123.60.0.0/15
123.62.0.0/16
123.64.0.0/11
123.96.0.0/15
123.98.0.0/17
123.99.128.0/17
123.100.0.0/19
123.101.0.0/16
123.103.0.0/17
123.108.128.0/20
123.108.208.0/20
123.112.0.0/12
123.128.0.0/13
123.136.80.0/20
123.137.0.0/16
123.138.0.0/15
123.144.0.0/12
123.160.0.0/12
123.176.60.0/22
123.176.80.0/20
123.177.0.0/16
123.178.0.0/15
123.180.0.0/14
123.184.0.0/13
123.196.0.0/15
123.199.128.0/17
123.206.0.0/15
123.232.0.0/14
123.242.0.0/17
123.244.0.0/14
123.249.0.0/16
123.253.0.0/16
124.6.64.0/18
124.14.0.0/15
124.16.0.0/15
124.20.0.0/14
124.28.192.0/18
124.29.0.0/17
124.31.0.0/16
124.40.112.0/20
124.40.128.0/18
124.40.192.0/19
124.42.0.0/16
124.47.0.0/18
124.64.0.0/15
124.66.0.0/17
124.67.0.0/16
124.68.0.0/14
124.72.0.0/13
124.88.0.0/13
124.108.8.0/21
124.108.40.0/21
124.109.96.0/21
124.112.0.0/13
124.126.0.0/15
124.128.0.0/13
124.147.128.0/17
124.151.0.0/16
124.152.0.0/16
124.156.0.0/16
124.160.0.0/13
124.172.0.0/14
124.192.0.0/15
124.196.0.0/16
124.200.0.0/13
124.220.0.0/14
124.224.0.0/12
124.240.0.0/17
124.240.128.0/18
124.242.0.0/16
124.243.192.0/18
124.248.0.0/17
124.249.0.0/16
124.250.0.0/15
124.254.0.0/18
125.31.192.0/18
125.32.0.0/12
125.58.128.0/17
125.61.128.0/17
125.62.0.0/18
125.64.0.0/11
125.96.0.0/15
125.98.0.0/16
125.104.0.0/13
125.112.0.0/12
125.169.0.0/16
125.171.0.0/16
125.208.0.0/18
125.210.0.0/15
125.213.0.0/17
125.214.96.0/19
125.215.0.0/18
125.216.0.0/13
125.254.128.0/17
127.0.0.0/8
139.9.0.0/16
139.129.0.0/16
139.148.0.0/16
139.155.0.0/16
139.159.0.0/16
139.170.0.0/16
139.176.0.0/16
139.183.0.0/16
139.186.0.0/16
139.189.0.0/16
139.196.0.0/14
139.200.0.0/13
139.208.0.0/13
139.217.0.0/16
139.219.0.0/16
139.220.0.0/15
139.224.0.0/16
139.226.0.0/15
140.75.0.0/16
140.143.0.0/16
140.205.0.0/16
140.206.0.0/15
140.210.0.0/16
140.224.0.0/16
140.237.0.0/16
140.240.0.0/16
140.243.0.0/16
140.246.0.0/16
140.249.0.0/16
140.250.0.0/16
140.255.0.0/16
144.0.0.0/16
144.7.0.0/16
144.12.0.0/16
144.52.0.0/16
144.123.0.0/16
144.255.0.0/16
150.0.0.0/16
150.115.0.0/16
150.121.0.0/16
150.122.0.0/16
150.129.152.0/22
150.129.192.0/22
150.129.216.0/22
150.129.252.0/22
150.138.0.0/15
150.223.0.0/16
150.242.0.0/21
150.242.8.0/22
150.242.28.0/22
150.242.44.0/22
150.242.48.0/21
150.242.56.0/22
150.242.76.0/22
150.242.80.0/22
150.242.92.0/22
150.242.96.0/22
150.242.112.0/21
150.242.120.0/22
150.242.152.0/21
150.242.160.0/21
150.242.168.0/22
150.242.184.0/21
150.242.192.0/22
150.242.212.0/22
150.242.224.0/22
150.242.232.0/21
150.242.240.0/21
150.242.248.0/22
150.255.0.0/16
152.104.128.0/17
153.0.0.0/16
153.3.0.0/16
153.34.0.0/15
153.36.0.0/15
153.99.0.0/16
153.101.0.0/16
153.118.0.0/15
157.0.0.0/16
157.18.0.0/16
157.61.0.0/16
157.122.0.0/16
157.148.0.0/16
157.156.0.0/16
157.255.0.0/16
159.226.0.0/16
161.207.0.0/16
162.105.0.0/16
163.0.0.0/16
163.47.4.0/22
163.53.0.0/20
163.53.36.0/22
163.53.40.0/21
163.53.48.0/20
163.53.64.0/22
163.53.88.0/21
163.53.96.0/19
163.53.128.0/21
163.53.136.0/22
163.53.160.0/20
163.53.188.0/22
163.53.220.0/22
163.53.240.0/22
163.125.0.0/16
163.142.0.0/16
163.177.0.0/16
163.179.0.0/16
163.204.0.0/16
166.111.0.0/16
167.139.0.0/16
167.189.0.0/16
168.160.0.0/16
169.254.0.0/16
171.8.0.0/13
171.34.0.0/15
171.36.0.0/14
171.40.0.0/13
171.80.0.0/12
171.104.0.0/13
171.112.0.0/12
171.208.0.0/12
172.16.0.0/12
175.0.0.0/12
175.16.0.0/13
175.24.0.0/14
175.30.0.0/15
175.42.0.0/15
175.44.0.0/16
175.46.0.0/15
175.48.0.0/12
175.64.0.0/11
175.102.0.0/16
175.106.128.0/17
175.146.0.0/15
175.148.0.0/14
175.152.0.0/14
175.160.0.0/12
175.178.0.0/16
175.184.128.0/18
175.185.0.0/16
175.186.0.0/15
175.188.0.0/14
180.76.0.0/14
180.84.0.0/15
180.86.0.0/16
180.88.0.0/14
180.94.56.0/21
180.94.96.0/20
180.95.128.0/17
180.96.0.0/11
180.129.128.0/17
180.130.0.0/16
180.136.0.0/13
180.148.16.0/21
180.148.152.0/21
180.148.216.0/21
180.148.224.0/19
180.149.128.0/19
180.150.160.0/19
180.152.0.0/13
180.160.0.0/12
180.178.192.0/18
180.184.0.0/14
180.188.0.0/17
180.189.148.0/22
180.200.252.0/22
180.201.0.0/16
180.202.0.0/15
180.208.0.0/15
180.210.224.0/19
180.212.0.0/15
180.222.224.0/19
180.223.0.0/16
180.233.0.0/18
180.233.64.0/19
180.235.64.0/19
182.16.192.0/19
182.18.0.0/17
182.23.184.0/21
182.23.200.0/21
182.32.0.0/12
182.48.96.0/19
182.49.0.0/16
182.50.0.0/20
182.50.112.0/20
182.51.0.0/16
182.54.0.0/17
182.61.0.0/16
182.80.0.0/13
182.88.0.0/14
182.92.0.0/16
182.96.0.0/11
182.128.0.0/12
182.144.0.0/13
182.157.0.0/16
182.160.64.0/19
182.174.0.0/15
182.200.0.0/13
182.236.128.0/17
182.238.0.0/16
182.239.0.0/19
182.240.0.0/13
182.254.0.0/16
183.0.0.0/10
183.64.0.0/13
183.78.180.0/22
183.81.180.0/22
183.84.0.0/15
183.91.128.0/22
183.91.136.0/21
183.91.144.0/20
183.92.0.0/14
183.128.0.0/11
183.160.0.0/13
183.168.0.0/15
183.170.0.0/16
183.172.0.0/14
183.182.0.0/19
183.184.0.0/13
183.192.0.0/10
192.0.0.0/29
192.0.2.0/24
192.88.99.0/24
192.124.154.0/24
192.168.0.0/16
192.188.170.0/24
198.18.0.0/15
198.51.100.0/24
202.0.100.0/23
202.0.122.0/23
202.0.176.0/22
202.3.128.0/23
202.4.128.0/19
202.4.252.0/22
202.6.6.0/23
202.6.66.0/23
202.6.72.0/23
202.6.87.0/24
202.6.88.0/23
202.6.92.0/23
202.6.103.0/24
202.6.108.0/24
202.6.110.0/23
202.6.114.0/24
202.6.176.0/20
202.8.0.0/24
202.8.2.0/23
202.8.4.0/23
202.8.12.0/24
202.8.24.0/24
202.8.77.0/24
202.8.128.0/19
202.8.192.0/20
202.9.32.0/24
202.9.34.0/23
202.9.48.0/23
202.9.51.0/24
202.9.52.0/23
202.9.54.0/24
202.9.57.0/24
202.9.58.0/23
202.10.64.0/20
202.12.1.0/24
202.12.2.0/24
202.12.17.0/24
202.12.18.0/23
202.12.72.0/24
202.12.84.0/23
202.12.96.0/24
202.12.98.0/23
202.12.106.0/24
202.12.111.0/24
202.12.116.0/24
202.14.64.0/23
202.14.69.0/24
202.14.73.0/24
202.14.74.0/23
202.14.76.0/24
202.14.78.0/23
202.14.88.0/24
202.14.97.0/24
202.14.104.0/23
202.14.108.0/23
202.14.111.0/24
202.14.114.0/23
202.14.118.0/23
202.14.124.0/23
202.14.127.0/24
202.14.129.0/24
202.14.135.0/24
202.14.136.0/24
202.14.149.0/24
202.14.151.0/24
202.14.157.0/24
202.14.158.0/23
202.14.169.0/24
202.14.170.0/23
202.14.176.0/24
202.14.184.0/23
202.14.208.0/23
202.14.213.0/24
202.14.219.0/24
202.14.220.0/24
202.14.222.0/23
202.14.225.0/24
202.14.226.0/23
202.14.231.0/24
202.14.235.0/24
202.14.236.0/22
202.14.246.0/24
202.14.251.0/24
202.20.66.0/24
202.20.79.0/24
202.20.87.0/24
202.20.88.0/23
202.20.90.0/24
202.20.94.0/23
202.20.114.0/24
202.20.117.0/24
202.20.120.0/24
202.20.125.0/24
202.20.127.0/24
202.21.131.0/24
202.21.132.0/24
202.21.141.0/24
202.21.142.0/24
202.21.147.0/24
202.21.148.0/24
202.21.150.0/23
202.21.152.0/23
202.21.154.0/24
202.21.156.0/24
202.22.248.0/21
202.27.136.0/23
202.38.0.0/22
202.38.8.0/21
202.38.48.0/20
202.38.64.0/18
202.38.128.0/21
202.38.136.0/23
202.38.138.0/24
202.38.140.0/22
202.38.146.0/23
202.38.149.0/24
202.38.150.0/23
202.38.152.0/22
202.38.156.0/24
202.38.158.0/23
202.38.160.0/23
202.38.164.0/22
202.38.168.0/22
202.38.176.0/23
202.38.184.0/21
202.38.192.0/18
202.40.4.0/23
202.40.7.0/24
202.40.15.0/24
202.40.135.0/24
202.40.136.0/24
202.40.140.0/24
202.40.143.0/24
202.40.144.0/23
202.40.150.0/24
202.40.155.0/24
202.40.156.0/24
202.40.158.0/23
202.40.162.0/24
202.41.8.0/23
202.41.11.0/24
202.41.12.0/23
202.41.128.0/24
202.41.130.0/23
202.41.152.0/21
202.41.192.0/24
202.41.240.0/20
202.43.76.0/22
202.43.144.0/20
202.44.16.0/20
202.44.67.0/24
202.44.74.0/24
202.44.129.0/24
202.44.132.0/23
202.44.146.0/23
202.45.0.0/23
202.45.2.0/24
202.45.15.0/24
202.45.16.0/20
202.46.16.0/23
202.46.18.0/24
202.46.20.0/23
202.46.32.0/19
202.46.128.0/24
202.46.224.0/20
202.47.82.0/23
202.47.126.0/24
202.47.128.0/24
202.47.130.0/23
202.57.240.0/20
202.58.0.0/24
202.59.0.0/24
202.59.212.0/22
202.59.232.0/23
202.59.236.0/24
202.60.48.0/21
202.60.96.0/21
202.60.112.0/20
202.60.132.0/22
202.60.136.0/21
202.60.144.0/20
202.62.112.0/22
202.62.248.0/22
202.62.252.0/24
202.62.255.0/24
202.63.81.0/24
202.63.82.0/23
202.63.84.0/22
202.63.88.0/21
202.63.160.0/19
202.63.248.0/22
202.65.0.0/21
202.65.8.0/23
202.67.0.0/22
202.69.4.0/22
202.69.16.0/20
202.70.0.0/19
202.70.96.0/20
202.70.192.0/20
202.72.40.0/21
202.72.80.0/20
202.73.128.0/22
202.74.8.0/21
202.74.80.0/20
202.74.254.0/23
202.75.208.0/20
202.75.252.0/22
202.76.252.0/22
202.77.80.0/21
202.77.92.0/22
202.78.8.0/21
202.79.224.0/21
202.79.248.0/22
202.80.192.0/20
202.81.0.0/22
202.83.252.0/22
202.84.0.0/20
202.84.16.0/23
202.84.24.0/21
202.85.208.0/20
202.86.249.0/24
202.86.252.0/22
202.87.80.0/20
202.89.8.0/21
202.89.232.0/21
202.90.0.0/22
202.90.112.0/20
202.90.196.0/24
202.90.224.0/20
202.91.0.0/22
202.91.96.0/20
202.91.128.0/22
202.91.176.0/20
202.91.224.0/19
202.92.0.0/22
202.92.8.0/21
202.92.48.0/20
202.92.252.0/22
202.93.0.0/22
202.93.252.0/22
202.94.92.0/22
202.95.0.0/19
202.95.240.0/21
202.95.252.0/22
202.96.0.0/12
202.112.0.0/13
202.120.0.0/15
202.122.0.0/21
202.122.32.0/21
202.122.64.0/19
202.122.112.0/20
202.122.128.0/24
202.122.132.0/24
202.123.96.0/20
202.124.16.0/21
202.124.24.0/22
202.125.112.0/20
202.125.176.0/20
202.127.0.0/21
202.127.12.0/22
202.127.16.0/20
202.127.40.0/21
202.127.48.0/20
202.127.112.0/20
202.127.128.0/19
202.127.160.0/21
202.127.192.0/20
202.127.208.0/23
202.127.212.0/22
202.127.216.0/21
202.127.224.0/19
202.130.0.0/19
202.130.224.0/19
202.131.16.0/21
202.131.48.0/20
202.131.208.0/20
202.133.32.0/20
202.134.58.0/24
202.134.128.0/20
202.136.48.0/20
202.136.208.0/20
202.136.224.0/20
202.137.231.0/24
202.141.160.0/19
202.142.16.0/20
202.143.4.0/22
202.143.16.0/20
202.143.32.0/20
202.143.56.0/21
202.146.160.0/20
202.146.188.0/22
202.146.196.0/22
202.146.200.0/21
202.147.144.0/20
202.148.32.0/20
202.148.64.0/18
202.149.32.0/19
202.149.160.0/19
202.149.224.0/19
202.150.16.0/20
202.150.32.0/20
202.150.56.0/22
202.150.192.0/20
202.150.224.0/19
202.151.0.0/22
202.151.128.0/19
202.152.176.0/20
202.153.0.0/22
202.153.48.0/20
202.157.192.0/19
202.158.160.0/19
202.160.176.0/20
202.162.67.0/24
202.162.75.0/24
202.164.0.0/20
202.164.96.0/19
202.165.96.0/20
202.165.176.0/20
202.165.208.0/20
202.165.239.0/24
202.165.240.0/23
202.165.243.0/24
202.165.245.0/24
202.165.251.0/24
202.165.252.0/22
202.166.224.0/19
202.168.160.0/19
202.170.128.0/19
202.170.216.0/21
202.170.224.0/19
202.171.216.0/21
202.171.235.0/24
202.172.0.0/22
202.173.0.0/22
202.173.8.0/21
202.173.224.0/19
202.174.64.0/20
202.176.224.0/19
202.179.240.0/20
202.180.128.0/19
202.180.208.0/21
202.181.112.0/20
202.182.32.0/20
202.182.192.0/19
202.189.0.0/18
202.189.80.0/20
202.189.184.0/21
202.191.0.0/24
202.191.68.0/22
202.191.72.0/21
202.191.80.0/20
202.192.0.0/12
203.0.4.0/22
203.0.10.0/23
203.0.18.0/24
203.0.24.0/24
203.0.42.0/23
203.0.45.0/24
203.0.46.0/23
203.0.81.0/24
203.0.82.0/23
203.0.90.0/23
203.0.96.0/23
203.0.104.0/21
203.0.113.0/24
203.0.114.0/23
203.0.122.0/24
203.0.128.0/24
203.0.130.0/23
203.0.132.0/22
203.0.137.0/24
203.0.142.0/24
203.0.144.0/24
203.0.146.0/24
203.0.148.0/24
203.0.150.0/23
203.0.152.0/24
203.0.177.0/24
203.0.224.0/24
203.1.4.0/22
203.1.18.0/24
203.1.26.0/23
203.1.65.0/24
203.1.66.0/23
203.1.70.0/23
203.1.76.0/23
203.1.90.0/24
203.1.97.0/24
203.1.98.0/23
203.1.100.0/22
203.1.108.0/24
203.1.253.0/24
203.1.254.0/24
203.2.64.0/21
203.2.73.0/24
203.2.112.0/21
203.2.126.0/23
203.2.140.0/24
203.2.150.0/24
203.2.152.0/22
203.2.156.0/23
203.2.160.0/21
203.2.180.0/23
203.2.196.0/23
203.2.209.0/24
203.2.214.0/23
203.2.226.0/23
203.2.229.0/24
203.2.236.0/23
203.3.68.0/24
203.3.72.0/23
203.3.75.0/24
203.3.80.0/21
203.3.96.0/22
203.3.105.0/24
203.3.112.0/21
203.3.120.0/24
203.3.123.0/24
203.3.135.0/24
203.3.139.0/24
203.3.143.0/24
203.4.132.0/23
203.4.134.0/24
203.4.151.0/24
203.4.152.0/22
203.4.174.0/23
203.4.180.0/24
203.4.186.0/24
203.4.205.0/24
203.4.208.0/22
203.4.227.0/24
203.4.230.0/23
203.5.4.0/23
203.5.7.0/24
203.5.8.0/23
203.5.11.0/24
203.5.21.0/24
203.5.22.0/24
203.5.44.0/24
203.5.46.0/23
203.5.52.0/22
203.5.56.0/23
203.5.60.0/23
203.5.114.0/23
203.5.118.0/24
203.5.120.0/24
203.5.172.0/24
203.5.180.0/23
203.5.182.0/24
203.5.185.0/24
203.5.186.0/24
203.5.188.0/23
203.5.190.0/24
203.5.195.0/24
203.5.214.0/23
203.5.218.0/23
203.6.131.0/24
203.6.136.0/24
203.6.138.0/23
203.6.142.0/24
203.6.150.0/23
203.6.157.0/24
203.6.159.0/24
203.6.224.0/20
203.6.248.0/23
203.7.129.0/24
203.7.138.0/23
203.7.147.0/24
203.7.150.0/23
203.7.158.0/24
203.7.192.0/23
203.7.200.0/24
203.8.0.0/24
203.8.8.0/24
203.8.23.0/24
203.8.24.0/21
203.8.70.0/24
203.8.82.0/24
203.8.86.0/23
203.8.91.0/24
203.8.110.0/23
203.8.115.0/24
203.8.166.0/23
203.8.169.0/24
203.8.173.0/24
203.8.184.0/24
203.8.186.0/23
203.8.190.0/23
203.8.192.0/24
203.8.197.0/24
203.8.198.0/23
203.8.203.0/24
203.8.209.0/24
203.8.210.0/23
203.8.212.0/22
203.8.217.0/24
203.8.220.0/24
203.9.32.0/24
203.9.36.0/23
203.9.57.0/24
203.9.63.0/24
203.9.65.0/24
203.9.70.0/23
203.9.72.0/24
203.9.75.0/24
203.9.76.0/23
203.9.96.0/22
203.9.100.0/23
203.9.108.0/24
203.9.158.0/24
203.10.34.0/24
203.10.56.0/24
203.10.74.0/23
203.10.84.0/22
203.10.88.0/24
203.10.95.0/24
203.10.125.0/24
203.11.70.0/24
203.11.76.0/22
203.11.82.0/24
203.11.84.0/22
203.11.100.0/22
203.11.109.0/24
203.11.117.0/24
203.11.122.0/24
203.11.126.0/24
203.11.136.0/22
203.11.141.0/24
203.11.142.0/23
203.11.180.0/22
203.11.208.0/22
203.12.16.0/24
203.12.19.0/24
203.12.24.0/24
203.12.57.0/24
203.12.65.0/24
203.12.66.0/24
203.12.70.0/23
203.12.87.0/24
203.12.88.0/21
203.12.100.0/23
203.12.103.0/24
203.12.114.0/24
203.12.118.0/24
203.12.130.0/24
203.12.137.0/24
203.12.196.0/22
203.12.200.0/21
203.12.211.0/24
203.12.219.0/24
203.12.226.0/24
203.12.240.0/22
203.13.18.0/24
203.13.24.0/24
203.13.44.0/23
203.13.80.0/21
203.13.88.0/23
203.13.92.0/22
203.13.173.0/24
203.13.224.0/23
203.13.227.0/24
203.13.233.0/24
203.14.24.0/22
203.14.33.0/24
203.14.56.0/24
203.14.61.0/24
203.14.62.0/24
203.14.104.0/24
203.14.114.0/23
203.14.118.0/24
203.14.162.0/24
203.14.184.0/21
203.14.192.0/24
203.14.194.0/23
203.14.214.0/24
203.14.231.0/24
203.14.246.0/24
203.15.0.0/20
203.15.20.0/23
203.15.22.0/24
203.15.87.0/24
203.15.88.0/23
203.15.105.0/24
203.15.112.0/21
203.15.130.0/23
203.15.149.0/24
203.15.151.0/24
203.15.156.0/22
203.15.174.0/24
203.15.227.0/24
203.15.232.0/21
203.15.240.0/23
203.15.246.0/24
203.16.10.0/24
203.16.12.0/23
203.16.16.0/21
203.16.27.0/24
203.16.38.0/24
203.16.49.0/24
203.16.50.0/23
203.16.58.0/24
203.16.133.0/24
203.16.161.0/24
203.16.162.0/24
203.16.186.0/23
203.16.228.0/24
203.16.238.0/24
203.16.240.0/24
203.16.245.0/24
203.17.2.0/24
203.17.18.0/24
203.17.28.0/24
203.17.39.0/24
203.17.56.0/24
203.17.74.0/23
203.17.88.0/23
203.17.136.0/24
203.17.164.0/24
203.17.187.0/24
203.17.190.0/23
203.17.231.0/24
203.17.233.0/24
203.17.248.0/24
203.17.255.0/24
203.18.2.0/23
203.18.4.0/24
203.18.7.0/24
203.18.31.0/24
203.18.37.0/24
203.18.48.0/23
203.18.52.0/24
203.18.72.0/22
203.18.80.0/23
203.18.87.0/24
203.18.100.0/23
203.18.105.0/24
203.18.107.0/24
203.18.110.0/24
203.18.129.0/24
203.18.131.0/24
203.18.132.0/23
203.18.144.0/24
203.18.153.0/24
203.18.199.0/24
203.18.208.0/24
203.18.211.0/24
203.18.215.0/24
203.19.18.0/24
203.19.24.0/24
203.19.30.0/24
203.19.32.0/21
203.19.41.0/24
203.19.44.0/23
203.19.46.0/24
203.19.58.0/24
203.19.60.0/23
203.19.64.0/24
203.19.68.0/24
203.19.72.0/24
203.19.101.0/24
203.19.111.0/24
203.19.131.0/24
203.19.133.0/24
203.19.144.0/24
203.19.149.0/24
203.19.156.0/24
203.19.176.0/24
203.19.178.0/23
203.19.208.0/24
203.19.228.0/22
203.19.233.0/24
203.19.242.0/24
203.19.248.0/23
203.19.255.0/24
203.20.17.0/24
203.20.40.0/23
203.20.48.0/24
203.20.61.0/24
203.20.65.0/24
203.20.84.0/23
203.20.89.0/24
203.20.106.0/23
203.20.115.0/24
203.20.117.0/24
203.20.118.0/23
203.20.122.0/24
203.20.126.0/23
203.20.135.0/24
203.20.136.0/21
203.20.150.0/24
203.20.230.0/24
203.20.232.0/24
203.20.236.0/24
203.21.0.0/23
203.21.2.0/24
203.21.8.0/24
203.21.10.0/24
203.21.18.0/24
203.21.33.0/24
203.21.34.0/24
203.21.41.0/24
203.21.44.0/24
203.21.68.0/24
203.21.82.0/24
203.21.96.0/22
203.21.124.0/24
203.21.136.0/23
203.21.145.0/24
203.21.206.0/24
203.22.24.0/24
203.22.28.0/23
203.22.31.0/24
203.22.68.0/24
203.22.76.0/24
203.22.78.0/24
203.22.84.0/24
203.22.87.0/24
203.22.92.0/22
203.22.99.0/24
203.22.106.0/24
203.22.122.0/23
203.22.131.0/24
203.22.163.0/24
203.22.166.0/24
203.22.170.0/24
203.22.176.0/21
203.22.194.0/24
203.22.242.0/23
203.22.245.0/24
203.22.246.0/24
203.22.252.0/23
203.23.0.0/24
203.23.47.0/24
203.23.61.0/24
203.23.62.0/23
203.23.73.0/24
203.23.85.0/24
203.23.92.0/22
203.23.98.0/24
203.23.107.0/24
203.23.112.0/24
203.23.130.0/24
203.23.140.0/23
203.23.172.0/24
203.23.182.0/24
203.23.186.0/23
203.23.192.0/24
203.23.197.0/24
203.23.198.0/24
203.23.204.0/22
203.23.224.0/24
203.23.226.0/23
203.23.228.0/22
203.23.249.0/24
203.23.251.0/24
203.24.13.0/24
203.24.18.0/24
203.24.27.0/24
203.24.43.0/24
203.24.56.0/24
203.24.58.0/24
203.24.67.0/24
203.24.74.0/24
203.24.79.0/24
203.24.80.0/23
203.24.84.0/23
203.24.86.0/24
203.24.90.0/24
203.24.111.0/24
203.24.112.0/24
203.24.116.0/24
203.24.122.0/23
203.24.145.0/24
203.24.152.0/23
203.24.157.0/24
203.24.161.0/24
203.24.167.0/24
203.24.186.0/23
203.24.199.0/24
203.24.202.0/24
203.24.212.0/23
203.24.217.0/24
203.24.219.0/24
203.24.244.0/24
203.25.19.0/24
203.25.20.0/23
203.25.46.0/24
203.25.48.0/21
203.25.64.0/23
203.25.91.0/24
203.25.99.0/24
203.25.100.0/24
203.25.106.0/24
203.25.131.0/24
203.25.135.0/24
203.25.138.0/24
203.25.147.0/24
203.25.153.0/24
203.25.154.0/23
203.25.164.0/24
203.25.166.0/24
203.25.174.0/23
203.25.180.0/24
203.25.182.0/24
203.25.191.0/24
203.25.199.0/24
203.25.200.0/24
203.25.202.0/23
203.25.208.0/20
203.25.229.0/24
203.25.235.0/24
203.25.236.0/24
203.25.242.0/24
203.26.12.0/24
203.26.34.0/24
203.26.49.0/24
203.26.50.0/24
203.26.55.0/24
203.26.56.0/23
203.26.60.0/24
203.26.65.0/24
203.26.68.0/24
203.26.76.0/24
203.26.80.0/24
203.26.84.0/24
203.26.97.0/24
203.26.102.0/23
203.26.115.0/24
203.26.116.0/24
203.26.129.0/24
203.26.143.0/24
203.26.144.0/24
203.26.148.0/23
203.26.154.0/24
203.26.158.0/23
203.26.170.0/24
203.26.173.0/24
203.26.176.0/24
203.26.185.0/24
203.26.202.0/23
203.26.210.0/24
203.26.214.0/24
203.26.222.0/24
203.26.224.0/24
203.26.228.0/24
203.26.232.0/24
203.27.0.0/24
203.27.10.0/24
203.27.15.0/24
203.27.16.0/24
203.27.20.0/24
203.27.22.0/23
203.27.40.0/24
203.27.45.0/24
203.27.53.0/24
203.27.65.0/24
203.27.66.0/24
203.27.81.0/24
203.27.88.0/24
203.27.102.0/24
203.27.109.0/24
203.27.117.0/24
203.27.121.0/24
203.27.122.0/23
203.27.125.0/24
203.27.200.0/24
203.27.202.0/24
203.27.233.0/24
203.27.241.0/24
203.27.250.0/24
203.28.10.0/24
203.28.12.0/24
203.28.33.0/24
203.28.34.0/23
203.28.43.0/24
203.28.44.0/24
203.28.54.0/24
203.28.56.0/24
203.28.73.0/24
203.28.74.0/24
203.28.76.0/24
203.28.86.0/24
203.28.88.0/24
203.28.112.0/24
203.28.131.0/24
203.28.136.0/24
203.28.140.0/24
203.28.145.0/24
203.28.165.0/24
203.28.169.0/24
203.28.170.0/24
203.28.178.0/23
203.28.185.0/24
203.28.187.0/24
203.28.196.0/24
203.28.226.0/23
203.28.239.0/24
203.29.2.0/24
203.29.8.0/23
203.29.13.0/24
203.29.14.0/24
203.29.28.0/24
203.29.46.0/24
203.29.57.0/24
203.29.61.0/24
203.29.63.0/24
203.29.69.0/24
203.29.73.0/24
203.29.81.0/24
203.29.90.0/24
203.29.95.0/24
203.29.100.0/24
203.29.103.0/24
203.29.112.0/24
203.29.120.0/22
203.29.182.0/23
203.29.187.0/24
203.29.189.0/24
203.29.190.0/24
203.29.205.0/24
203.29.210.0/24
203.29.217.0/24
203.29.227.0/24
203.29.231.0/24
203.29.233.0/24
203.29.234.0/24
203.29.248.0/24
203.29.254.0/23
203.30.16.0/23
203.30.25.0/24
203.30.27.0/24
203.30.29.0/24
203.30.66.0/24
203.30.81.0/24
203.30.87.0/24
203.30.111.0/24
203.30.121.0/24
203.30.123.0/24
203.30.152.0/24
203.30.156.0/24
203.30.162.0/24
203.30.173.0/24
203.30.175.0/24
203.30.187.0/24
203.30.194.0/24
203.30.217.0/24
203.30.220.0/24
203.30.222.0/24
203.30.232.0/23
203.30.235.0/24
203.30.240.0/23
203.30.246.0/24
203.30.250.0/23
203.31.45.0/24
203.31.46.0/24
203.31.49.0/24
203.31.51.0/24
203.31.54.0/23
203.31.69.0/24
203.31.72.0/24
203.31.80.0/24
203.31.85.0/24
203.31.97.0/24
203.31.105.0/24
203.31.106.0/24
203.31.108.0/23
203.31.124.0/24
203.31.162.0/24
203.31.174.0/24
203.31.177.0/24
203.31.181.0/24
203.31.187.0/24
203.31.189.0/24
203.31.204.0/24
203.31.220.0/24
203.31.222.0/23
203.31.225.0/24
203.31.229.0/24
203.31.248.0/23
203.31.253.0/24
203.32.20.0/24
203.32.48.0/23
203.32.56.0/24
203.32.60.0/24
203.32.62.0/24
203.32.68.0/23
203.32.76.0/24
203.32.81.0/24
203.32.84.0/23
203.32.95.0/24
203.32.102.0/24
203.32.105.0/24
203.32.130.0/24
203.32.133.0/24
203.32.140.0/24
203.32.152.0/24
203.32.186.0/23
203.32.192.0/24
203.32.196.0/24
203.32.203.0/24
203.32.204.0/23
203.32.212.0/24
203.33.4.0/24
203.33.7.0/24
203.33.8.0/21
203.33.21.0/24
203.33.26.0/24
203.33.32.0/24
203.33.63.0/24
203.33.64.0/24
203.33.67.0/24
203.33.68.0/24
203.33.73.0/24
203.33.79.0/24
203.33.100.0/24
203.33.122.0/24
203.33.129.0/24
203.33.131.0/24
203.33.145.0/24
203.33.156.0/24
203.33.158.0/23
203.33.174.0/24
203.33.185.0/24
203.33.200.0/24
203.33.202.0/23
203.33.204.0/24
203.33.206.0/23
203.33.214.0/23
203.33.224.0/23
203.33.226.0/24
203.33.233.0/24
203.33.243.0/24
203.33.250.0/24
203.34.4.0/24
203.34.21.0/24
203.34.27.0/24
203.34.39.0/24
203.34.48.0/23
203.34.54.0/24
203.34.56.0/23
203.34.67.0/24
203.34.69.0/24
203.34.76.0/24
203.34.92.0/24
203.34.106.0/24
203.34.113.0/24
203.34.147.0/24
203.34.150.0/24
203.34.152.0/23
203.34.161.0/24
203.34.162.0/24
203.34.187.0/24
203.34.192.0/21
203.34.204.0/22
203.34.232.0/24
203.34.240.0/24
203.34.242.0/24
203.34.245.0/24
203.34.251.0/24
203.55.2.0/23
203.55.4.0/24
203.55.10.0/24
203.55.13.0/24
203.55.22.0/24
203.55.30.0/24
203.55.93.0/24
203.55.101.0/24
203.55.109.0/24
203.55.110.0/24
203.55.116.0/23
203.55.119.0/24
203.55.128.0/23
203.55.146.0/23
203.55.192.0/24
203.55.196.0/24
203.55.218.0/23
203.55.221.0/24
203.55.224.0/24
203.56.1.0/24
203.56.4.0/24
203.56.12.0/24
203.56.24.0/24
203.56.38.0/24
203.56.40.0/24
203.56.46.0/24
203.56.48.0/21
203.56.68.0/23
203.56.82.0/23
203.56.84.0/23
203.56.95.0/24
203.56.110.0/24
203.56.121.0/24
203.56.161.0/24
203.56.169.0/24
203.56.172.0/23
203.56.175.0/24
203.56.183.0/24
203.56.185.0/24
203.56.187.0/24
203.56.192.0/24
203.56.198.0/24
203.56.201.0/24
203.56.208.0/23
203.56.210.0/24
203.56.214.0/24
203.56.216.0/24
203.56.227.0/24
203.56.228.0/24
203.56.232.0/24
203.56.240.0/24
203.56.252.0/24
203.56.254.0/24
203.57.5.0/24
203.57.6.0/24
203.57.12.0/23
203.57.28.0/24
203.57.39.0/24
203.57.46.0/24
203.57.58.0/24
203.57.61.0/24
203.57.66.0/24
203.57.69.0/24
203.57.70.0/23
203.57.73.0/24
203.57.90.0/24
203.57.101.0/24
203.57.109.0/24
203.57.123.0/24
203.57.157.0/24
203.57.200.0/24
203.57.202.0/24
203.57.206.0/24
203.57.222.0/24
203.57.224.0/20
203.57.246.0/23
203.57.249.0/24
203.57.253.0/24
203.57.254.0/23
203.62.2.0/24
203.62.131.0/24
203.62.139.0/24
203.62.161.0/24
203.62.197.0/24
203.62.228.0/22
203.62.234.0/24
203.62.246.0/24
203.76.160.0/22
203.76.168.0/22
203.77.180.0/22
203.78.48.0/20
203.79.0.0/20
203.79.32.0/20
203.80.4.0/23
203.80.32.0/20
203.80.57.0/24
203.80.132.0/22
203.80.136.0/21
203.80.144.0/20
203.81.0.0/21
203.81.16.0/20
203.82.0.0/23
203.82.16.0/21
203.83.0.0/22
203.83.56.0/21
203.83.224.0/20
203.86.0.0/17
203.86.254.0/23
203.88.32.0/19
203.88.192.0/19
203.89.0.0/22
203.89.8.0/21
203.89.136.0/22
203.90.0.0/22
203.90.8.0/22
203.90.128.0/18
203.90.192.0/19
203.91.32.0/19
203.91.96.0/20
203.91.120.0/21
203.92.0.0/22
203.92.160.0/19
203.93.0.0/16
203.94.0.0/19
203.95.0.0/21
203.95.96.0/19
203.95.128.0/18
203.95.224.0/19
203.99.8.0/21
203.99.16.0/20
203.99.80.0/20
203.100.32.0/20
203.100.48.0/21
203.100.63.0/24
203.100.80.0/20
203.100.96.0/19
203.100.192.0/20
203.104.32.0/20
203.105.96.0/19
203.105.128.0/19
203.107.0.0/17
203.110.160.0/19
203.110.208.0/20
203.110.232.0/23
203.110.234.0/24
203.114.244.0/22
203.118.192.0/19
203.118.241.0/24
203.118.248.0/22
203.119.24.0/21
203.119.32.0/22
203.119.80.0/22
203.119.85.0/24
203.119.113.0/24
203.119.114.0/23
203.119.116.0/22
203.119.120.0/21
203.119.128.0/17
203.128.32.0/19
203.128.96.0/19
203.128.224.0/21
203.129.8.0/21
203.130.32.0/19
203.132.32.0/19
203.134.240.0/21
203.135.96.0/19
203.135.160.0/20
203.142.224.0/19
203.144.96.0/19
203.145.0.0/19
203.148.0.0/18
203.148.64.0/20
203.148.80.0/22
203.148.86.0/23
203.149.92.0/22
203.152.64.0/19
203.152.128.0/19
203.153.0.0/22
203.156.192.0/18
203.158.16.0/21
203.160.104.0/21
203.160.129.0/24
203.160.192.0/19
203.161.0.0/22
203.161.180.0/24
203.161.192.0/19
203.166.160.0/19
203.168.0.0/19
203.170.58.0/23
203.171.0.0/22
203.171.224.0/20
203.174.4.0/24
203.174.7.0/24
203.174.96.0/19
203.175.128.0/19
203.175.192.0/18
203.176.0.0/18
203.176.64.0/19
203.176.168.0/21
203.184.80.0/20
203.187.160.0/19
203.189.0.0/23
203.189.6.0/23
203.189.112.0/22
203.189.192.0/19
203.190.96.0/20
203.190.249.0/24
203.191.0.0/23
203.191.16.0/20
203.191.64.0/18
203.191.144.0/20
203.192.0.0/19
203.193.224.0/19
203.194.120.0/21
203.195.64.0/19
203.195.112.0/21
203.195.128.0/17
203.196.0.0/20
203.202.236.0/22
203.205.64.0/19
203.205.128.0/17
203.207.64.0/18
203.207.128.0/17
203.208.0.0/20
203.208.16.0/22
203.208.32.0/19
203.209.224.0/19
203.212.0.0/20
203.212.80.0/20
203.215.232.0/21
203.222.192.0/20
203.223.0.0/20
203.223.16.0/21
210.2.0.0/19
210.5.0.0/19
210.5.56.0/21
210.5.128.0/19
210.12.0.0/15
210.14.64.0/19
210.14.112.0/20
210.14.128.0/17
210.15.0.0/17
210.15.128.0/18
210.16.128.0/18
210.21.0.0/16
210.22.0.0/16
210.23.32.0/19
210.25.0.0/16
210.26.0.0/15
210.28.0.0/14
210.32.0.0/12
210.48.136.0/21
210.51.0.0/16
210.52.0.0/15
210.56.192.0/19
210.72.0.0/14
210.76.0.0/15
210.78.0.0/16
210.79.64.0/18
210.79.224.0/19
210.82.0.0/15
210.87.128.0/18
210.185.192.0/18
210.192.96.0/19
211.64.0.0/13
211.80.0.0/12
211.96.0.0/13
211.136.0.0/13
211.144.0.0/12
211.160.0.0/13
218.0.0.0/11
218.56.0.0/13
218.64.0.0/11
218.96.0.0/14
218.100.88.0/21
218.100.96.0/19
218.100.128.0/17
218.104.0.0/14
218.108.0.0/15
218.185.192.0/19
218.185.240.0/21
218.192.0.0/12
218.240.0.0/13
218.249.0.0/16
219.72.0.0/16
219.82.0.0/16
219.83.128.0/17
219.128.0.0/11
219.216.0.0/13
219.224.0.0/12
219.242.0.0/15
219.244.0.0/14
220.101.192.0/18
220.112.0.0/14
220.152.128.0/17
220.154.0.0/15
220.160.0.0/11
220.192.0.0/12
220.231.0.0/18
220.231.128.0/17
220.232.64.0/18
220.234.0.0/16
220.242.0.0/15
220.247.136.0/21
220.248.0.0/14
220.252.0.0/16
221.0.0.0/13
221.8.0.0/14
221.12.0.0/17
221.12.128.0/18
221.13.0.0/16
221.14.0.0/15
221.122.0.0/15
221.128.128.0/17
221.129.0.0/16
221.130.0.0/15
221.133.224.0/19
221.136.0.0/15
221.172.0.0/14
221.176.0.0/13
221.192.0.0/14
221.196.0.0/15
221.198.0.0/16
221.199.0.0/17
221.199.128.0/18
221.199.192.0/20
221.199.224.0/19
221.200.0.0/13
221.208.0.0/12
221.224.0.0/12
222.16.0.0/12
222.32.0.0/11
222.64.0.0/11
222.125.0.0/16
222.126.128.0/17
222.128.0.0/12
222.160.0.0/14
222.168.0.0/13
222.176.0.0/12
222.192.0.0/11
222.240.0.0/13
222.248.0.0/15
223.0.0.0/12
223.20.0.0/15
223.27.184.0/22
223.64.0.0/11
223.96.0.0/12
223.112.0.0/14
223.116.0.0/15
223.120.0.0/13
223.128.0.0/15
223.144.0.0/12
223.160.0.0/14
223.166.0.0/15
223.192.0.0/15
223.198.0.0/15
223.201.0.0/16
223.202.0.0/15
223.208.0.0/13
223.220.0.0/15
223.223.176.0/20
223.223.192.0/20
223.240.0.0/13
223.248.0.0/14
223.252.128.0/17
223.254.0.0/16
223.255.0.0/17
223.255.236.0/22
223.255.252.0/23

**Comment by hk3f** [comment]
root@bbk6752_lwt_l:/ # netcfg
netcfg
ccmni2   DOWN                                   0.0.0.0/0   0x00000080
ccmni0   UP                               10.34.242.174/8   0x000000c1
ccmni1   DOWN                                   0.0.0.0/0   0x00000080
wlan0    UP                                     0.0.0.0/0   0x00001003
tunl0    DOWN                                   0.0.0.0/0   0x00000080
tun0     UP                                  26.26.26.1/24  0x00000051
sit0     DOWN                                   0.0.0.0/0   0x00000080
p2p0     UP                                     0.0.0.0/0   0x00001003
ifb0     DOWN                                   0.0.0.0/0   0x00000082
ifb1     DOWN                                   0.0.0.0/0   0x00000082
lo       UP                                   127.0.0.1/8   0x00000049
ip6tnl0  DOWN                                   0.0.0.0/0   0x00000080

**Comment by hk3f** [comment]
root@bbk6752_lwt_l:/ # tcpdump -i ccmni0 tcp dst port 5228
tcpdump -i ccmni0 tcp dst port 5228
activate_mmap...^C
D:\priv\Txt\hosts\shadowsocks\pull-reinstall-again3>adb shell
root@bbk6752_lwt_l:/ # tcpdump -i tun0 tcp dst port 5228
tcpdump -i tun0 tcp dst port 5228
activate_mmap...14:01:59.196041 IP 26.26.26.1.38054 > sb-in-f188.1e100.net.5228: Flags [P.], seq 534099805:534099836, ack 7084, win 65535, length 31
14:01:59.196644 IP 26.26.26.1.38054 > sb-in-f188.1e100.net.5228: Flags [F.], seq 31, ack 1, win 65535, length 0
14:01:59.560494 IP 26.26.26.1.38054 > sb-in-f188.1e100.net.5228: Flags [.], ack 2, win 65535, length 0
14:02:00.380520 IP 26.26.26.1.46164 > sb-in-f188.1e100.net.5228: Flags [S], seq 1106350651, win 65535, options [mss 1460,sackOK,TS val 302708 ecr 0,nop,wscale 6], length
0
14:02:00.380682 IP 26.26.26.1.46164 > sb-in-f188.1e100.net.5228: Flags [.], ack 7550, win 65535, length 0
14:02:00.385968 IP 26.26.26.1.46164 > sb-in-f188.1e100.net.5228: Flags [P.], seq 0:517, ack 1, win 65535, length 517
14:02:00.607904 IP 26.26.26.1.46164 > sb-in-f188.1e100.net.5228: Flags [.], ack 138, win 65535, length 0
14:02:00.608294 IP 26.26.26.1.46164 > sb-in-f188.1e100.net.5228: Flags [P.], seq 517:568, ack 138, win 65535, length 51
14:02:00.811769 IP 26.26.26.1.46164 > sb-in-f188.1e100.net.5228: Flags [P.], seq 568:904, ack 138, win 65535, length 336
14:02:00.961073 IP 26.26.26.1.46164 > sb-in-f188.1e100.net.5228: Flags [.], ack 168, win 65535, length 0
14:02:00.961206 IP 26.26.26.1.46164 > sb-in-f188.1e100.net.5228: Flags [.], ack 406, win 65535, length 0
14:02:15.681761 IP 26.26.26.1.46164 > sb-in-f188.1e100.net.5228: Flags [P.], seq 904:935, ack 406, win 65535, length 31
14:02:15.691794 IP 26.26.26.1.46164 > sb-in-f188.1e100.net.5228: Flags [F.], seq 935, ack 406, win 65535, length 0
14:02:16.083308 IP 26.26.26.1.46164 > sb-in-f188.1e100.net.5228: Flags [.], ack 407, win 65535, length 0
14:02:16.613100 IP 26.26.26.1.55084 > sb-in-f188.1e100.net.5228: Flags [S], seq 1483057396, win 65535, options [mss 1460,sackOK,TS val 304332 ecr 0,nop,wscale 6], length
0
14:02:16.613559 IP 26.26.26.1.55084 > sb-in-f188.1e100.net.5228: Flags [.], ack 7767, win 65535, length 0
14:02:16.622623 IP 26.26.26.1.55084 > sb-in-f188.1e100.net.5228: Flags [P.], seq 0:517, ack 1, win 65535, length 517
14:02:16.849837 IP 26.26.26.1.55084 > sb-in-f188.1e100.net.5228: Flags [.], ack 138, win 65535, length 0
14:02:16.851611 IP 26.26.26.1.55084 > sb-in-f188.1e100.net.5228: Flags [P.], seq 517:568, ack 138, win 65535, length 51
14:02:17.089174 IP 26.26.26.1.55084 > sb-in-f188.1e100.net.5228: Flags [P.], seq 568:904, ack 138, win 65535, length 336
14:02:17.241089 IP 26.26.26.1.55084 > sb-in-f188.1e100.net.5228: Flags [.], ack 168, win 65535, length 0
14:02:17.241237 IP 26.26.26.1.55084 > sb-in-f188.1e100.net.5228: Flags [.], ack 406, win 65535, length 0
tcpdump: pcap_loop: The interface went down
22 packets captured
22 packets received by filter
0 packets dropped by kernel
1|root@bbk6752_lwt_l:/ # tcpdump -i tun0 tcp dst port 5228
tcpdump -i tun0 tcp dst port 5228
activate_mmap...14:02:41.974077 IP 26.26.26.1.55084 > sb-in-f188.1e100.net.5228: Flags [P.], seq 1483058301:1483058332, ack 8172, win 65535, length 31
^C

**Comment by hk3f** [comment]
cmmni0 should be 4G network connection.
Dumping  cmmni0 get no result.
Dumping tun0 has different:
"Bypass LAN" get some result
"Bypass LNA&China" get no feedback?

**Comment by madeye** [comment]
Could you try `tcp dump -i tun0 udp dst port 53` with chnroute enabled?

**Comment by hk3f** [comment]
D:\priv\Txt\hosts\shadowsocks\pull-reinstall-again3>adb shell tcpdump -i tun0 udp dst port 53
activate_mmap...14:18:42.735572 IP 26.26.26.1.41161 > google-public-dns-a.google.com.domain: 3064+ A? ssl.google-analytics.com. (42)
14:18:43.731848 IP 26.26.26.1.11367 > google-public-dns-a.google.com.domain: 676+ PTR? 1.26.26.26.in-addr.arpa. (41)
14:18:43.903706 IP 26.26.26.1.49415 > google-public-dns-a.google.com.domain: 45875+ PTR? 8.8.8.8.in-addr.arpa. (38)
14:19:03.013832 IP 26.26.26.1.11077 > google-public-dns-a.google.com.domain: 21921+ AAAA? www.googletagmanager.com. (42)
tcpdump: pcap_loop: The interface went down

My ssserver may not support UDP forwording? I'm not sure.

**Comment by madeye** [comment]
It seems IPv6 addr is taken as the dest addr on your device, while the normal behaviour should be choosing IPv4 addr by default.

In LAN and ALL route mode, all AAAA requests are dropped by default. But in CHN route mode, I allowed IPv6 in pdnsd.

**Comment by madeye** [comment]
Here is a hotfix, could you try if it works for you? You need to press the "reset" button after installing this build.

https://dl.dropboxusercontent.com/u/4356689/shadowsocks-nightly-ipv6-hotfix.apk

**Comment by hk3f** [comment]
YES.
It worked.
GJ.
![image](https://cloud.githubusercontent.com/assets/2787342/9377541/985f10f0-474c-11e5-90bb-3f4b69b651df.png)

![image](https://cloud.githubusercontent.com/assets/2787342/9377543/9dc63f64-474c-11e5-995d-c0f6f952ce2b.png)

**Comment by madeye** [comment]
Although it works, your device still has an issue that prevents you visiting IPv6 websites while enabling shadowsocks. It's actually an issue of your device provider.

**Comment by kydan** [comment]
@madeye was this issue hotfix released to stable on the play store yet? I also have a similar issue. Cannot connect to gms on global mode or per-app mode of bypass China routing is enabled on wifi and 4G. I can access if shadowsocks is disabled, or if I do global proxy and routing all. Meizu MX5

**Comment by kydan** [comment]
Damn phone posted this prematurely when I switched apps to check my build version. I am on 2.7.7, so it sounds like this has not been released.
